category,severity,title,evidence,recommendation
engine_coverage,info,Available benchmarked engines,"jax_projection, numba_projection, numpy_loop, numpy_vectorized, reference",Keep reference as the baseline. Treat optional engines as experimental until workflow-level benchmarks show stable gains.
projection_kernel,info,Projection kernel speedup measured,Best non-reference projection-kernel speedup: 2.64x.,"Kernel speedup is useful, but do not overinterpret it. Projection may be only a small fraction of full fitting time."
batched_projection,medium,Production batch projection speedup measured,Best non-reference batch-method speedup: 1.32x.,Batched projection appears worth productionizing further. Next targets: reduce residual DataFrame construction and avoid per-evaluation pandas overhead in variable projection.
workflow,medium,Workflow speedup is marginal,Best non-reference workflow speedup: 1.06x.,"Projection acceleration is not yet dominating end-to-end time. Next target should be profiling residual assembly, ODE solving, and optimizer callback overhead."
bottleneck_inference,high,Kernel speedup does not translate to workflow speedup,"Kernel speedup is 2.64x, but workflow speedup is only 1.06x.","The bottleneck is likely outside the scalar projection kernel. Prioritize timing residual assembly, ODE simulation calls, DataFrame construction, and scipy least_squares callback overhead."
